{
  "schemaVersion": 1,
  "repository": "https://github.com/solidaris-danielbodigil/solidaris-plectrum",
  "teams": [
    {
      "id": "design-system",
      "label": "Design-system",
      "kind": "core",
      "reviewer": "@solidaris-danielbodigil",
      "alternateReviewers": [
        "@danielbodi"
      ]
    },
    {
      "id": "ishare",
      "label": "iSHARE",
      "kind": "application",
      "reviewer": null
    },
    {
      "id": "icrm",
      "label": "iCRM",
      "kind": "application",
      "reviewer": null
    },
    {
      "id": "iged",
      "label": "iGED",
      "kind": "application",
      "reviewer": null
    }
  ],
  "applications": [
    {
      "id": "ishare",
      "team": "ishare",
      "label": "iSHARE",
      "path": "apps/ishare",
      "repository": "https://github.com/solidaris-danielbodigil/solidaris-plectrum",
      "kind": "local-demo"
    },
    {
      "id": "icrm",
      "team": "icrm",
      "label": "iCRM",
      "path": "apps/icrm",
      "repository": "https://github.com/solidaris-danielbodigil/solidaris-plectrum",
      "kind": "local-demo"
    },
    {
      "id": "iged",
      "team": "iged",
      "label": "iGED",
      "path": "apps/iged",
      "repository": "https://github.com/solidaris-danielbodigil/solidaris-plectrum",
      "kind": "local-demo"
    }
  ],
  "operations": {
    "registry": "https://npm.pkg.github.com",
    "publicationScope": "@solidaris-danielbodigil",
    "visibility": "private",
    "publicationEnabled": true,
    "reportTransport": "reviewed-pull-request",
    "reportIngestionEnabled": false,
    "editors": [
      "cursor",
      "vscode-copilot"
    ],
    "storybook": "https://solidaris-danielbodigil.github.io/solidaris-plectrum/storybook/",
    "figma": {
      "componentLibrary": "IRkr21rHS0w7rI0bgrv1fZ",
      "tokenLibrary": "wjMnb8GsK8bVKA7UreOJ4L",
      "proposalCollectionPrefix": "proposals/",
      "identitiesVerifiedForPublication": false
    },
    "pending": [
      "Prove candidate promotion and adoption from a registered external application",
      "Verify the PrimeNG 21 token export and Custom components publication with design owners",
      "Confirm external reporting after a registered application's reviewed report"
    ]
  }
}
